tweet-sno-1380	We  are  not  prepared  for  a  pandemic.  Trump  has  rolled  back  progress  President  Obama  and  I  made  to  strengthen  global  health  security.  We  need  leadership  that  builds  public  trust,  focuses  on  real  threats,  and  mobilizes  the  world  to  stop  outbreaks  before  they  reach  our  shores.  https://t.co/1qqpgayUEX  —  Joe  Biden  (@JoeBiden)  October  25,  2019
tweet-sno-1381	As  recently  as  last  month,  Webster’s  Dictionary  included  a  definition  of  “preference”  as  “orientation”  or  “sexual  preference.”  TODAY  they  changed  it  and  added  the  word  “offensive."  Insane  –  I  just  checked  through  Wayback  Machine  and  it’s  real.  (via  @ThorSvensonn  &  @chadfelixg  )  pic.twitter.com/oOq1SNtCP2  —  Steve  Krakauer  (@SteveKrak)  October  14,  2020
tweet-sno-1382	Well  where  was  the  dignity  and  respect  of  Black  Americans  or  in  your  words  @JoeBiden  "Niggers"  when  you  made  this  statement?  Democrats  this  is  YOUR  nominee  for  President  of  the  United  States  and  @RepMaxineWaters  endorsed  this  scoundrel!  Explain  this  please!  https://t.co/JY8XPqilOW  pic.twitter.com/SX7hsB0e1F  —  Joe  E.  Collins  III  For  Congress  CA-43  (@joecollins43rd)  June  29,  2020
tweet-sno-1383	Uhhhhh  look  at  this  picture  of  Mitch  McConnell's  hands  that  @lizzyratner  found  on  AP  pic.twitter.com/Y4LJL7mAdh  —  Annie  Shields  (@anastasiakeeley)  October  21,  2020
tweet-sno-1384	A  nurse  who  has  gained  national  attention  for  her  service  was  arrested  for  shooting  someone.  The  latest  on  this  wild  story:  pic.twitter.com/7hzS6IzFZe  —  Anthony  Conn  (@AnthonyWCHS)  October  9,  2020
tweet-sno-1385	Joe  Biden  surrogate  Jane  Fonda  calls  coronavirus  "God's  gift  to  the  Left."  pic.twitter.com/981uTDTUXG  —  Daily  Caller  (@DailyCaller)  October  7,  2020
tweet-sno-1386	Joe  Biden  and  Kamala  Harris  BOTH  want  to  BAN  FRACKING.  pic.twitter.com/FpcvoVXcKH  —  Donald  J.  Trump  (@realDonaldTrump)  October  8,  2020
tweet-sno-1387	10/13/60:  "Unlike  the  first  two  programs,  however,  the  two  candidates  will  not  be  sharing  same  platform.  In  New  York…John  F.  Kennedy  separated  by  3,000  miles  in  a  Los  Angeles  studio…Richard  Nixon.  Now  joined  for  tonight's  discussion  by  network  of  electronic  facilities…"  pic.twitter.com/2cZch1EyNe  —  CSPAN  (@cspan)  October  8,  2020
tweet-sno-1388	The  Rules:  "You  will  keep  your  mask  on."  Meanwhile,  Karen  Pence:  pic.twitter.com/DAHk5Fqqrs  —  The  Recount  (@therecount)  October  8,  2020
tweet-sno-1389	A  Trump  sign  was  erected  on  the  hillside  along  the  405  Freeway  near  the  Sepulveda  Pass.  It’s  unclear  who  put  it  there  📹:  Sky5  pic.twitter.com/ac71WxbYW2  —  KTLA  (@KTLA)  October  6,  2020
tweet-sno-1390	This  is  the  Democrat  nominee  for  VP  instigating  violent  riots  that  have  left  multiple  Americans  dead:  "Everyone  beware.  They're  not  gonna  stop  before  election  day  in  November,  and  they're  not  gonna  stop  after  election  day…  They’re  not  gonna  let  up  and  they  should  not."  pic.twitter.com/nhDAMc2c7c  —  Benny  (@bennyjohnson)  August  30,  2020
tweet-sno-1391	Joe  Biden  called  Trump  supporters  the  "dregs  of  society."  The  idea  that  Biden  is  a  unifier  is  a  joke.  pic.twitter.com/k4gSzNaiOR  —  Trump  War  Room  –  Text  TRUMP  to  88022  (@TrumpWarRoom)  October  6,  2020
tweet-sno-1392	Biden:  ‘I  Was  Able  to  Stay  Sequestered’  Thanks  to  ‘Some  Black  Woman’  Who  Stocked  Grocery  Shelves  pic.twitter.com/raalFcUNKF  —  TheLeoTerrell  (@TheLeoTerrell)  October  6,  2020
tweet-sno-1393	Was  Andy  McCabe  ever  forced  to  pay  back  the  $700,000  illegally  given  to  him  and  his  wife,  for  his  wife’s  political  campaign,  by  Crooked  Hillary  Clinton  while  Hillary  was  under  FBI  investigation,  and  McCabe  was  the  head  of  the  FBI???  Just  askin’?  —  Donald  J.  Trump  (@realDonaldTrump)  September  12,  2020
tweet-sno-1394	I  wonder  if  the  BTS  and  TikTok  kids  can  help  LGBTs  with  this.  What  if  gay  guys  took  pictures  of  themselves  making  out  with  each  other  or  doing  very  gay  things,  then  tagged  themselves  with  #ProudBoys  .  I  bet  it  would  mess  them  up  real  bad.  #ReclaimingMyShine  —  George  Takei  (@GeorgeTakei)  October  1,  2020
tweet-sno-1395	.  @JerickFL  and  I  are  joining  thousands  of  gay  men  on  social  media  to  reclaim  #ProudBoys  from  white  supremacists  and  bigoted  neo-nazis.  Let’s  replace  the  hashtag  with  images  of  love,  positivity,  and  true  PRIDE!  Your  two  favorite  #ProudBoys  are  here  standing  by,  ready  to  VOTE!  🏳️‍🌈🗳  pic.twitter.com/8k8iUlfFFx  —  Rep.  Carlos  G  Smith  (@CarlosGSmith)  October  4,  2020
tweet-sno-1396	Wow!  Check  out  this  huge  group  of  bikers  gathered  to  pray  for  President  @realDonaldTrump  and  the  First  Lady.  The  country  is  behind  you,  Mr.  President!  🇺🇸  pic.twitter.com/GRIY1Pywfg  —  Jake  Schneider  (@jacobkschneider)  October  3,  2020
tweet-sno-1397	That  “donate  to  help  him  recover”  email  that’s  been  going  around  looks  fake  to  me.  —  Trump  Fundraising  Emails  (@TrumpEmail)  October  2,  2020
tweet-sno-1398	This  reporter  just  exposed  Kayleigh  McEnany  for  lying  about  Amy  Coney  Barrett  being  a  Rhodes  Scholar.  Barrett  attended  Rhodes  College.  pic.twitter.com/u9Qk5uZEhp  —  NowThis  (@nowthisnews)  October  1,  2020
tweet-sno-1399	New  in  @WGAL  interview  Q:  Do  you  condemn  Antifa?  BIDEN:  Yes,  I  do  —  violence,  no  matter  who  it  is.  pic.twitter.com/dkhlwQn62K  —  Johnny  Verhovek  (@JTHVerhovek)  September  7,  2020
tweet-sno-1400	Only  three  things  happened  tonight:  1.  #DonaldTrump  refused  to  condemn  white  supremacy.  2.  The  #POTUS  refused  to  condemn  white  supremacy.  3.  The  #CommanderInChief  REFUSED  to  condemn  white  supremacy  on  the  GLOBAL  STAGE.  NOW  LOOK  AT  WHAT  IS  HAPPENING  ONLINE.  THIS  IS  NOT  OKAY.  pic.twitter.com/OhANFUYqNS  —  Van  Jones  (@VanJones68)  September  30,  2020
tweet-sno-1401	Wow,  nobody  realized  how  far  Mini  Mike  Bloomberg  went  in  bribing  ex-prisoners  to  go  out  and  vote  for  Sleepy  Joe.  He  is  desperate  to  get  back  into  the  good  graces  of  the  people  who  not  only  badly  beat  him,  but  made  him  look  like  a  total  fool.  Now  he’s  committed  a  serious  crime!  —  Donald  J.  Trump  (@realDonaldTrump)  September  27,  2020
